"Term","Overlap","P.value","Adjusted.P.value","Old.P.value","Old.Adjusted.P.value","Odds.Ratio","Combined.Score","Genes"
"regulation of immune response (GO:0050776)","3/179",8.07745416161068e-05,0.00582807378420495,0,0,48.2483766233766,454.685402337051,"CD96;KLRK1;ITGAL"
"regulation of T cell differentiation (GO:0045580)","2/39",0.000165089798425088,0.00582807378420495,0,0,134.817567567568,1174.12902701043,"CD2;ZAP70"
"natural killer cell activation (GO:0030101)","2/43",0.000200968061524309,0.00582807378420495,0,0,121.640243902439,1035.44610131594,"CD2;KLRK1"
"T cell activation (GO:0042110)","2/92",0.000919529637153113,0.0188796685186463,0,0,55.2777777777778,386.482780067336,"CD2;ZAP70"
"cell-matrix adhesion (GO:0007160)","2/100",0.00108503842061186,0.0188796685186463,0,0,50.7448979591837,346.391771762865,"CD96;ITGAL"
"T cell extravasation (GO:0072683)","1/5",0.00249770786419674,0.0271625730231396,0,0,555.166666666667,3326.77064151216,"ITGAL"
"positive thymic T cell selection (GO:0045059)","1/5",0.00249770786419674,0.0271625730231396,0,0,555.166666666667,3326.77064151216,"ZAP70"
"membrane raft distribution (GO:0031580)","1/5",0.00249770786419674,0.0271625730231396,0,0,555.166666666667,3326.77064151216,"CD2"
"regulation of natural killer cell chemotaxis (GO:2000501)","1/7",0.003495224297089,0.031586111339692,0,0,370.074074074074,2093.27134911451,"KLRK1"
"cellular response to interleukin-21 (GO:0098757)","1/8",0.00399364626134036,0.031586111339692,0,0,317.190476190476,1751.8590547314,"STAT4"
"interleukin-21-mediated signaling pathway (GO:0038114)","1/8",0.00399364626134036,0.031586111339692,0,0,317.190476190476,1751.8590547314,"STAT4"
"interleukin-23-mediated signaling pathway (GO:0038155)","1/9",0.00449184410751083,0.0325658697794535,0,0,277.527777777778,1500.17416789664,"STAT4"
"interleukin-35-mediated signaling pathway (GO:0070757)","1/11",0.00548756766902295,0.0346497561222302,0,0,222,1155.5699775562,"STAT4"
"inflammatory response (GO:0006954)","2/230",0.00557582282426693,0.0346497561222302,0,0,21.6688596491228,112.446546660068,"CD96;ITGAL"
"T cell migration (GO:0072678)","1/18",0.00896555009334736,0.0432848450266586,0,0,130.542483660131,615.425022203049,"ZAP70"
"positive regulation of leukocyte activation (GO:0002696)","1/19",0.00946151051239574,0.0432848450266586,0,0,123.283950617284,574.567716360615,"CD2"
"positive regulation of natural killer cell mediated cytotoxicity (GO:0045954)","1/20",0.0099572476243862,0.0432848450266586,0,0,116.789473684211,538.335775363175,"KLRK1"
"positive regulation of lymphocyte differentiation (GO:0045621)","1/20",0.0099572476243862,0.0432848450266586,0,0,116.789473684211,538.335775363175,"ZAP70"
"regulation of lymphocyte differentiation (GO:0045619)","1/20",0.0099572476243862,0.0432848450266586,0,0,116.789473684211,538.335775363175,"CD2"
"natural killer cell mediated immunity (GO:0002228)","1/20",0.0099572476243862,0.0432848450266586,0,0,116.789473684211,538.335775363175,"KLRK1"
"natural killer cell mediated cytotoxicity (GO:0042267)","1/22",0.0109480522580433,0.0432848450266586,0,0,105.656084656085,476.99429568907,"KLRK1"
"positive regulation of natural killer cell mediated immunity (GO:0002717)","1/23",0.0114431199495764,0.0432848450266586,0,0,100.848484848485,450.82969906826,"KLRK1"
"negative regulation of GTPase activity (GO:0034260)","1/23",0.0114431199495764,0.0432848450266586,0,0,100.848484848485,450.82969906826,"KLRK1"
"receptor signaling pathway via STAT (GO:0097696)","1/25",0.0124325865055396,0.044647361117006,0,0,92.4351851851852,405.553302875665,"STAT4"
"receptor clustering (GO:0043113)","1/28",0.0139151155631478,0.044647361117006,0,0,82.1522633744856,351.182817850539,"ITGAL"
"T cell activation involved in immune response (GO:0002286)","1/28",0.0139151155631478,0.044647361117006,0,0,82.1522633744856,351.182817850539,"ITGAL"
"leukocyte cell-cell adhesion (GO:0007159)","1/28",0.0139151155631478,0.044647361117006,0,0,82.1522633744856,351.182817850539,"ITGAL"
"regulation of natural killer cell mediated cytotoxicity (GO:0042269)","1/30",0.0149023554252654,0.044647361117006,0,0,76.4789272030651,321.688416559315,"KLRK1"
"heterotypic cell-cell adhesion (GO:0034113)","1/30",0.0149023554252654,0.044647361117006,0,0,76.4789272030651,321.688416559315,"CD2"
"receptor signaling pathway via JAK-STAT (GO:0007259)","1/31",0.0153956417644848,0.044647361117006,0,0,73.9259259259259,308.542479281304,"STAT4"
"response to peptide (GO:1901652)","1/39",0.0193339377497967,0.0491913993976565,0,0,58.3391812865497,230.20018425525,"STAT4"
"lymphocyte migration (GO:0072676)","1/40",0.019825226718581,0.0491913993976565,0,0,56.8404558404558,222.860063552568,"ZAP70"
"T cell differentiation (GO:0030217)","1/41",0.0203162941970357,0.0491913993976565,0,0,55.4166666666667,215.921734165782,"ZAP70"
"heterophilic cell-cell adhesion via plasma membrane cell adhesion molecules (GO:0007157)","1/42",0.0208071402680989,0.0491913993976565,0,0,54.0623306233062,209.35416251688,"ITGAL"
"positive regulation of leukocyte mediated cytotoxicity (GO:0001912)","1/43",0.0212977650246516,0.0491913993976565,0,0,52.7724867724868,203.129383176071,"KLRK1"
"positive regulation of T cell differentiation (GO:0045582)","1/43",0.0212977650246516,0.0491913993976565,0,0,52.7724867724868,203.129383176071,"ZAP70"
"interleukin-12-mediated signaling pathway (GO:0035722)","1/46",0.0227683122669265,0.0491913993976565,0,0,49.2469135802469,186.270812956763,"STAT4"
"neutrophil degranulation (GO:0043312)","2/481",0.0228573295023555,0.0491913993976565,0,0,10.1831941544885,38.4770305514311,"TBC1D10C;ITGAL"
"neutrophil activation involved in immune response (GO:0002283)","2/485",0.0232146575493646,0.0491913993976565,0,0,10.0967908902692,37.9939354415718,"TBC1D10C;ITGAL"
"regulation of T cell activation (GO:0050863)","1/47",0.0232580526351399,0.0491913993976565,0,0,48.1739130434783,181.187090155358,"CD2"
"neutrophil mediated immunity (GO:0002446)","2/488",0.0234842106288948,0.0491913993976565,0,0,10.0329218106996,37.6377734864398,"TBC1D10C;ITGAL"
"cellular response to interleukin-12 (GO:0071349)","1/48",0.0237475721230066,0.0491913993976565,0,0,47.1465721040189,176.341144039401,"STAT4"
"response to peptide hormone (GO:0043434)","1/52",0.0257034430516593,0.0520046405928921,0,0,43.4400871459695,159.039820378248,"STAT4"
"peptidyl-tyrosine modification (GO:0018212)","1/56",0.0276557869621033,0.0541492502084306,0,0,40.2727272727273,144.495334893691,"ZAP70"
"positive regulation of interferon-gamma production (GO:0032729)","1/57",0.0281433225032358,0.0541492502084306,0,0,39.5515873015873,141.216773601099,"CD2"
"negative regulation of hydrolase activity (GO:0051346)","1/58",0.0286306380412392,0.0541492502084306,0,0,38.8557504873294,138.065278498392,"KLRK1"
"positive regulation of interleukin-8 production (GO:0032757)","1/61",0.030091265543298,0.0557008532397219,0,0,36.9074074074074,129.305852202468,"CD2"
"regulation of cilium assembly (GO:1902017)","1/64",0.0315499162070124,0.05718422312521,0,0,35.1446208112875,121.466288289776,"TBC1D10C"
"peptidyl-tyrosine phosphorylation (GO:0018108)","1/69",0.033976614095502,0.0599626558786045,0,0,32.5522875816993,110.094532313003,"ZAP70"
"regulation of plasma membrane bounded cell projection assembly (GO:0120032)","1/70",0.0344612964819566,0.0599626558786045,0,0,32.0789049919485,108.039135201302,"TBC1D10C"
"positive regulation of T cell activation (GO:0050870)","1/75",0.0368814272661001,0.0621277670016808,0,0,29.9039039039039,98.6842937720567,"ZAP70"
"regulation of organelle assembly (GO:1902115)","1/77",0.0378479500125182,0.0621277670016808,0,0,29.1140350877193,95.3245466085723,"TBC1D10C"
"positive regulation of tumor necrosis factor production (GO:0032760)","1/77",0.0378479500125182,0.0621277670016808,0,0,29.1140350877193,95.3245466085723,"CD2"
"regulation of interleukin-8 production (GO:0032677)","1/81",0.039778377237952,0.062922160358215,0,0,27.6527777777778,89.1644960195625,"CD2"
"positive regulation of tumor necrosis factor superfamily cytokine production (GO:1903557)","1/81",0.039778377237952,0.062922160358215,0,0,27.6527777777778,89.1644960195625,"CD2"
"lymphocyte differentiation (GO:0030098)","1/84",0.0412239094208195,0.0632797638277131,0,0,26.6492637215529,84.9774896594187,"ZAP70"
"B cell activation (GO:0042113)","1/85",0.0417053180950638,0.0632797638277131,0,0,26.3306878306878,83.6559293891733,"ZAP70"
"regulation of interferon-gamma production (GO:0032649)","1/86",0.0421865092184754,0.0632797638277131,0,0,26.0196078431373,82.3690963539015,"CD2"
"retrograde transport, endosome to Golgi (GO:0042147)","1/88",0.0431482391729825,0.0636253696279573,0,0,25.418901660281,79.894497269575,"TBC1D10C"
"activation of GTPase activity (GO:0090630)","1/105",0.0512879221660425,0.0743674871407616,0,0,21.2457264957265,63.1061811953445,"TBC1D10C"
"cytosolic transport (GO:0016482)","1/116",0.0565215144325385,0.0806126517316533,0,0,19.2028985507246,55.1724993207883,"TBC1D10C"
"regulation of tumor necrosis factor production (GO:0032680)","1/124",0.0603114275885762,0.0846305516162278,0,0,17.9467028003613,50.3985352660787,"CD2"
"enzyme linked receptor protein signaling pathway (GO:0007167)","1/140",0.0678501777388972,0.0936978644965723,0,0,15.8681055155875,42.6923964226082,"ZAP70"
"T cell receptor signaling pathway (GO:0050852)","1/158",0.0762661742978172,0.103674330686095,0,0,14.036093418259,36.1222480385121,"ZAP70"
"cell-cell adhesion via plasma-membrane adhesion molecules (GO:0098742)","1/170",0.0818387819286868,0.109538061966088,0,0,13.0315581854043,32.6180427988393,"ITGAL"
"antigen receptor-mediated signaling pathway (GO:0050851)","1/185",0.0887619858291805,0.117004435865738,0,0,11.9601449275362,28.965040810505,"ZAP70"
"regulation of GTPase activity (GO:0043087)","1/189",0.09060022102857,0.117645063126651,0,0,11.7033096926714,28.1031414884941,"KLRK1"
"protein localization to membrane (GO:0072657)","1/195",0.0933513166113739,0.119434772723375,0,0,11.3379152348225,26.8865655778966,"ITGAL"
"positive regulation of GTPase activity (GO:0043547)","1/214",0.102013775990435,0.126670410002262,0,0,10.3166405842462,23.5492529723353,"TBC1D10C"
"extracellular structure organization (GO:0043062)","1/216",0.102921266673785,0.126670410002262,0,0,10.2196382428941,23.2373212993106,"ITGAL"
"external encapsulating structure organization (GO:0045229)","1/217",0.103374702415639,0.126670410002262,0,0,10.1718106995885,23.0838563866398,"ITGAL"
"apoptotic process (GO:0006915)","1/231",0.109701181199882,0.132555593949858,0,0,9.54589371980676,21.0963787679381,"CD2"
"extracellular matrix organization (GO:0030198)","1/300",0.140298659988022,0.165971607772129,0,0,7.3173541434411,14.3711506762771,"ITGAL"
"innate immune response (GO:0045087)","1/302",0.141171252587788,0.165971607772129,0,0,7.26799557032115,14.2291477654931,"ZAP70"
"cellular protein localization (GO:0034613)","1/329",0.152873491550634,0.176128544367803,0,0,6.66056910569106,12.5095115806125,"TBC1D10C"
"positive regulation of cytokine production (GO:0001819)","1/335",0.155454418333024,0.176128544367803,0,0,6.53892215568862,12.17156748663,"CD2"
"intracellular protein transport (GO:0006886)","1/336",0.155883884095642,0.176128544367803,0,0,6.51907131011609,12.1166320043004,"TBC1D10C"
"protein transport (GO:0015031)","1/369",0.169946460366191,0.189555667331521,0,0,5.92451690821256,10.4998544260896,"TBC1D10C"
"phosphorylation (GO:0016310)","1/400",0.182964318900209,0.200785764621938,0,0,5.45558340295182,9.2661126845247,"ZAP70"
"transmembrane receptor protein tyrosine kinase signaling pathway (GO:0007169)","1/404",0.184630588158104,0.200785764621938,0,0,5.40033085194375,9.12330960396866,"ZAP70"
"cellular response to cytokine stimulus (GO:0071345)","1/482",0.216517536062526,0.232555872067157,0,0,4.50658350658351,6.89545013213669,"STAT4"
"protein phosphorylation (GO:0006468)","1/496",0.222120526143145,0.235664460664069,0,0,4.37598204264871,6.58381872838317,"ZAP70"
"cytokine-mediated signaling pathway (GO:0019221)","1/621",0.270571665999959,0.283611264361403,0,0,3.47132616487455,4.53778100740268,"STAT4"
"regulation of cell population proliferation (GO:0042127)","1/764",0.322656086594778,0.334179518258877,0,0,2.7999126256007,3.16717232194457,"STAT4"
"cellular protein modification process (GO:0006464)","1/1025",0.409165958885707,0.41879339321243,0,0,2.05794270833333,1.83904847517365,"ZAP70"
"regulation of transcription by RNA polymerase II (GO:0006357)","1/2206",0.689318157023675,0.695891150397805,0,0,0.896195515243134,0.333431645881209,"STAT4"
"regulation of transcription, DNA-templated (GO:0006355)","1/2244",0.695891150397805,0.695891150397805,0,0,0.879130133254074,0.318739200458797,"STAT4"
